### ISSUE TITLE
Smart/RG modem not appearing in genieacs

### ISSUE THREAD

**Issue by mAineAc-** [zaidka/genieacs#205]
I have set this up and I can see the traffic hitting the server using tshark, but it never shows up in the geniacs homescreen as a device. Reading the docs it sounds like all i have to do is point the modem to it and it should show up. I have disabled all authentication until I can get the modem to show up. If I do a getRPCMethods from the modem I see this in tshark:

727 1011.850924 192.168.15.1 -> 192.168.15.100 TCP 74 47155→7547 [SYN] Seq=0 Win=5760 Len=0 MSS=1402 SACK_PERM=1 TSval=350404965 TSecr=0 WS=2
728 1011.850991 192.168.15.100 -> 192.168.15.1 TCP 74 7547→47155 [SYN, ACK] Seq=0 Ack=1 Win=28960 Len=0 MSS=1460 SACK_PERM=1 TSval=234107959 TSecr=350404965 WS=128
729 1011.899808 192.168.15.1 -> 192.168.15.100 TCP 66 47155→7547 [ACK] Seq=1 Ack=1 Win=5760 Len=0 TSval=350405006 TSecr=234107959
730 1011.931598 192.168.15.1 -> 192.168.15.100 TCP 66 47155→7547 [FIN, ACK] Seq=1 Ack=1 Win=5760 Len=0 TSval=350405035 TSecr=234107959
732 1011.932707 192.168.15.100 -> 192.168.15.1 TCP 66 7547→47155 [ACK] Seq=1 Ack=2 Win=29056 Len=0 TSval=234107980 TSecr=350405035
733 1011.932838 192.168.15.100 -> 192.168.15.1 TCP 66 7547→47155 [FIN, ACK] Seq=1 Ack=2 Win=29056 Len=0 TSval=234107980 TSecr=350405035
734 1011.972608 192.168.15.1 -> 192.168.15.100 TCP 66 47155→7547 [ACK] Seq=2 Ack=2 Win=5760 Len=0 TSval=350405088 TSecr=234107980

The logs do not show anything at all other than this:

14 Feb 10:18:49 - Worker 10128 listening to 0.0.0.0:7547
14 Feb 10:18:49 - Worker 10125 listening to 0.0.0.0:7547
14 Feb 10:18:49 - Worker 10127 listening to 0.0.0.0:7547
14 Feb 10:18:49 - Worker 10126 listening to 0.0.0.0:7547

Is there some configuration step that I am missing to get genieacs to recognize the devices I point to it?

**Comment by mAineAc-** [comment]
in the capture above 192.168.15.1  is the modem and 192.168.15.100 is the server. There is nothing in the error logs. and I am pointing the modem to http://192.168.15.100:7547

**Comment by mAineAc-** [comment]
In the modem I am getting this error:

syslog: httpd:701.484:cgiTr69cGetRpcMethods:467:tr69c returned 9809   

But I cannot find anything anywhere to tell me what a return code of 9809

**Comment by mAineAc-** [comment]
at one point I got this log but it has not returned:

3 Feb 11:34:48 - 3c9066-96318REF-3c90661a20aa: Inform (0 BOOTSTRAP); retry count 0
3 Feb 11:34:48 - Worker 1190 died (0)
3 Feb 11:34:48 - Worker 1719 listening to 0.0.0.0:7547
3 Feb 11:34:58 - 3c9066-96318REF-3c90661a20aa: Inform (0 BOOTSTRAP); retry count 1
3 Feb 11:34:58 - Worker 1186 died (0)
3 Feb 11:34:58 - Worker 1732 listening to 0.0.0.0:7547
3 Feb 11:36:59 - 3c9066-96318REF-SR360NA036%2D5001391: Inform (0 BOOTSTRAP,1 BOOT); retry count 0
3 Feb 11:36:59 - Worker 1184 died (0)
3 Feb 11:36:59 - Worker 1749 listening to 0.0.0.0:7547
3 Feb 11:37:06 - 3c9066-96318REF-SR360NA036%2D5001391: Inform (0 BOOTSTRAP,1 BOOT); retry count 1
3 Feb 11:37:06 - Worker 1719 died (0)
3 Feb 11:37:07 - Worker 1762 listening to 0.0.0.0:7547
3 Feb 11:37:18 - 3c9066-96318REF-SR360NA036%2D5001391: Inform (0 BOOTSTRAP,1 BOOT); retry count 2
3 Feb 11:37:18 - Worker 1732 died (0)

**Comment by mAineAc-** [comment]
I just tried adding a VisionNet modem and I get this in the logs but still does not show up in the interface:

14 Feb 11:42:34 - F45FF7-96332R-f45ff7424182: Inform (1 BOOT,0 BOOTSTRAP,2 PERIODIC); retry count 1
14 Feb 11:42:34 - Worker 10126 died (0)
14 Feb 11:42:34 - Worker 10456 listening to 0.0.0.0:7547
14 Feb 11:42:50 - F45FF7-96332R-f45ff7424182: Inform (1 BOOT,0 BOOTSTRAP,2 PERIODIC); retry count 2
14 Feb 11:42:50 - Worker 10128 died (0)
14 Feb 11:42:50 - Worker 10469 listening to 0.0.0.0:7547
14 Feb 11:43:16 - F45FF7-96332R-f45ff7424182: Inform (1 BOOT,0 BOOTSTRAP,2 PERIODIC); retry count 3
14 Feb 11:43:16 - Worker 10125 died (0)
14 Feb 11:43:16 - Worker 10492 listening to 0.0.0.0:7547

**Comment by DrumSergio** [comment]
Hi @mAineAc- !

A good installation is a good point to start. Here I wrote a guide for v1.0 latest stable version: https://github.com/zaidka/genieacs/wiki/Installation-in-Ubuntu-14.04-Server,-64-bit (because I've noticed you're using v1.1-alpha for GenieACS-base, and better to test with v1.0)

Anyway, better to post all of this info, along with the logs in the router, the install method you're using, and the complete traceback in a file to the mailing list. There is where you will get help of this kind of topics. This is only for bugs in the code. It may be a bug, but if you don't know, better to start with the mailing list.

Have a nice day! :-)

**Comment by akcoder** [comment]
This is a closed issue, but since it comes up in the google machine when searching for "tr69c returned 9809" I thought I would add to this.

I found the [Broadcom return codes](https://github.com/vicgarin/Actiontec-V1000H/blob/master/bcm963xx_V1000H-31-121L-11/userspace/public/include/cms.h)!

Here is the 9800 series of codes:
```C
   CMSRET_SUCCESS_REBOOT_REQUIRED = 9800, /**< Config successful, but requires reboot to take effect. */
   CMSRET_SUCCESS_UNRECOGNIZED_DATA_IGNORED = 9801,  /**<Success, but some unrecognized data was ignored. */
   CMSRET_SUCCESS_OBJECT_UNCHANGED = 9802,  /**<Success, furthermore object has not changed, returned by STL handler functions. */
   CMSRET_FAIL_REBOOT_REQUIRED = 9803,  /**<Config failed, and now system is in a bad state requiring reboot. */
   CMSRET_NO_MORE_INSTANCES = 9804,     /**<getnext operation cannot find any more instances to return. */
   CMSRET_MDM_TREE_ERROR = 9805,         /**<Error during MDM tree traversal */
   CMSRET_WOULD_DEADLOCK = 9806, /**< Caller is requesting a lock while holding the same lock or a different one. */
   CMSRET_LOCK_REQUIRED = 9807,  /**< The MDM lock is required for this operation. */
   CMSRET_OP_INTR = 9808,      /**<Operation was interrupted, most likely by a Linux signal. */
   CMSRET_TIMED_OUT = 9809,     /**<Operation timed out. */
   CMSRET_DISCONNECTED = 9810,  /**< Communications link is disconnected. */
   CMSRET_MSG_BOUNCED = 9811,   /**< Msg was sent to a process not running, and the
                                 *   bounceIfNotRunning flag was set on the header.  */
   CMSRET_OP_ABORTED_BY_USER = 9812,  /**< Operation was aborted/discontinued by the user */
   CMSRET_RECURSION_ERROR = 9817,     /**< too many levels of recursion */
   CMSRET_OPEN_FILE_ERROR = 9818,     /**< open file error */
   CMSRET_KEY_GENERATION_ERROR = 9830,     /** certificate key generation error */
   CMSRET_INVALID_CERT_REQ = 9831,     /** requested certificate does not match with issued certificate */
   CMSRET_INVALID_CERT_SUBJECT = 9832,     /** certificate has invalid subject information */
   CMSRET_OBJECT_NOT_FOUND = 9840,     /** failed to find object */

   CMSRET_INVALID_FILENAME = 9850,  /**< filename was not given for download */
   CMSRET_INVALID_IMAGE = 9851,     /**< bad image was given for download */
   CMSRET_INVALID_CONFIG_FILE = 9852,  /**< invalid config file was detected */
   CMSRET_CONFIG_PSI = 9853,         /**< old PSI/3.x config file was detected */
   CMSRET_IMAGE_FLASH_FAILED = 9854, /**< could not write the image to flash */
   CMSRET_RESOURCE_NOT_CONFIGURED = 9855, /**< requested resource is not configured/found */
#if defined(AEI_VDSL_CUSTOMER_NCS)
   CMSRET_OLD_IMAGE = 9856, /**< old image was given for download */
   CMSRET_CURRENT_IMAGE = 9857, /**< current image was given for download */
   CMSRET_ERASED_CONFIG_FILE = 9858,  /**< the config file was erased */
#if defined(AEI_VDSL_CUSTOMER_CENTURYLINK)
   CMSRET_CORRUPTED_IMAGE = 9859, /**< corrupted image was given for download*/
#endif
#endif
```
